{"$schema":"https://json-schema.org/draft/2020-12/schema","$id":"https://lnhgames.dev/lnh-prism/schemas/focal-object/1.0","type":"object","additionalProperties":false,"required":["schemaVersion","id","version","status","presets","compatibility"],"properties":{"schemaVersion":{"const":"1.0"},"id":{"type":"string"},"version":{"type":"string"},"status":{"enum":["draft","reviewed","approved","deprecated"]},"presets":{"type":"array","minItems":2,"items":{"type":"object","additionalProperties":false,"required":["id","version","layers"],"properties":{"id":{"type":"string"},"version":{"type":"string"},"layers":{"type":"array","minItems":1,"items":{"enum":["core","facets","rim","inner-light","fractures","support-frame","back-ring","floating-shards","particles","ground-glow"]}}}}},"compatibility":{"type":"object","additionalProperties":false,"required":["minimumRendererVersion"],"properties":{"minimumRendererVersion":{"type":"string"}}}}}
