{"schemaVersion":"1.0","id":"m10-volcanic-forge-focal-objects","version":"0.1.0","status":"approved","presets":[{"id":"m10-molten-core","version":"1.0.0","layers":["core","facets","rim","inner-light","fractures","support-frame","back-ring","floating-shards","particles","ground-glow"]},{"id":"m10-ember-mark","version":"1.0.0","layers":["core","rim","inner-light"]}],"compatibility":{"minimumRendererVersion":"0.1.0"}}
