{"schemaVersion":"1.0","id":"m9-frostbound-focal-objects","version":"1.0.0","status":"approved","presets":[{"id":"m9-frostbound-crystal","version":"1.0.0","layers":["core","facets","rim","inner-light","fractures","support-frame","back-ring","floating-shards","particles","ground-glow"]},{"id":"m9-placeholder-orb","version":"1.0.0","layers":["core","rim","inner-light"]}],"compatibility":{"minimumRendererVersion":"0.1.0"}}
